{
  "versao_contrato": "3.0.0",
  "funcionalidade": {
    "id": "tipos-recurso",
    "nome": "Tipos de recurso",
    "rota_inicial": "/",
    "objetivo": "Classificar categorias físicas ou operacionais de recursos (veículos, alimentos, equipamentos)."
  },
  "pre_condicoes": [
    "Unidades de medida previamente cadastradas"
  ],
  "fluxos": [
    {
      "id": "FLUXO-01",
      "titulo": "Cadastrar tipo de recurso operacional",
      "descricao": "Cria um tipo de recurso com categoria e modo de controle.",
      "passos": [
        {
          "acao": "click",
          "alvo": {
            "role": "button",
            "name": "Recursos e ofertas"
          }
        },
        {
          "acao": "click",
          "alvo": {
            "role": "button",
            "name": "Tipos de recurso"
          }
        },
        {
          "acao": "fill",
          "alvo": {
            "css": "#recurso-nome"
          },
          "valor": "Bote Resgate {{RUN_ID}}"
        },
        {
          "acao": "select",
          "alvo": {
            "css": "#recurso-categoria"
          },
          "valor": "equipamento"
        },
        {
          "acao": "select",
          "alvo": {
            "css": "#recurso-modo"
          },
          "valor": "individual"
        },
        {
          "acao": "click",
          "alvo": {
            "role": "button",
            "name": "Salvar cadastro"
          }
        }
      ],
      "resultado_esperado": {
        "descricao": "Tipo de recurso cadastrado visível na lista.",
        "verificacoes": [
          {
            "acao": "visible",
            "alvo": {
              "text": "Bote Resgate {{RUN_ID}}"
            }
          }
        ]
      },
      "excecoes": [
        {
          "id": "EXC-01-01",
          "cenario": "Submissão sem preenchimento do nome obrigatório",
          "passos": [
            {
              "acao": "fill",
              "alvo": {
                "css": "#recurso-nome"
              },
              "valor": ""
            }
          ],
          "resultado_esperado": {
            "descricao": "Botão Salvar cadastro visível sem submissão de dados.",
            "verificacoes": [
              {
                "acao": "visible",
                "alvo": {
                  "role": "button",
                  "name": "Salvar cadastro"
                }
              }
            ]
          }
        }
      ]
    }
  ]
}